id,comment_text,toxic,severe_toxic,obscene,threat,insult,identity_hate
fd0cfcb54fc0cf4e,"Fucking nerd 

You are a fucking nerd ass BiTCH... YOU LIL FUCKER GROW UP BITCH GET OUT YOUR MOMS BASEMENT GO GET LAID U NERD",0,1,0,0,0,0
eaac711515924435,"""

 Disscussions with DMacks 

oth have understanding difficulty's.OneMadScientist (talk) 
I am talking about your behavior...we are all responsible for what we ourselves do, even if we feel provoked by others. It's a great test of one's strength to recognize when to help raise the level of discussion rather than inflaming tense situations. Your edits were explicitly written to insult a person rather than as constructive criticism of specific actions, and you even said you were trying to undo your previous steps towards repairing the destructive atmosphere here. That's all forbidden. Period. No """"but he said..."""" or """"I'm just proving I was right all along"""". What are your personal intents for being a Wikipedia editor? If it's to improve wikipedia articles, then go do so now and stop wasting everyone's time with discussions about your previous battles. If it is anything else, including trying to school others in morality or your sense of religious obligation, no...this website it not for you. DMacks (talk) 

@DMacks WELL - I'am talking about your, and Plasmic Physics's behavior and responsibility around here and maybe this website it not for you.
You Would Do well Take your own advice DMacks. Is there not a word for describing the lack of following one's own advice (rules) which I have been condemned for using. Oh, yes now I remember, It is (hypocrite).
And I was Beginning to think you had realized YOUR errors in regards to YOUR application of YOUR """"Obligations"""" as a Wikipedia """"morality code"""" enforcer and understood my very significant and valid arguments.
Specifically for now -
In regards to YOUR choice!!(and the actual definition) of what exactly constitutes a personal attack around here. And the objectivity by which it is applied and the selective abuse of its application by YOU in particular.
You are now bringing up the very important point that I would Have Very Much desired to take up with you in your absence.
I am sorry, I mistook your silence for understanding on your behalf.
I contend that you have failed miserably in the """"great test of one's strength to recognize when to help raise the level of discussion rather than inflaming tense situations"""" and should have known better given your display of """"apparent"""" authority.
I contend that (In This issue with Plasmic Physics - which you had been following from the start, at least) that after my initial """"transgressions"""" and subsequent overly profuse apologies, was being very polite and civil.
I was then was the subject of an Obvious personal attack from Plasmic Physics, who was my initial accuser!! in the very first instance (again NOT taking ones own advice!!).
His remarks which OBVIOUSLY """"were explicitly written to insult a person (me) rather than as constructive criticism of specific actions"""" and contained no factual justification.
My response contained words and statements that were correctly and appropriately describing (with civil English words) the FACTS in relation to nature of his personal attacks on me.
In my attempt to obtain an apology from him, while Lacking any support against his attack, you decided to label me the transgressor, but not him.
You appear to be very negligent and biased acting in your """"appointed role here???"""" to say the least, if not totally malicious.
I contend that your obviously biased behavior should preclude you from further involvement in any """"moral code violation"""" disciplinary action, let alone this specific one.
This is for starters in addressing your negative comments about me.
I hope I have I made this point clear to YOU now!  
OneMadScientist (talk) 
I would appreciate and DESERVE an apology from both of you but I can see that is unlikely. If not Please don't waste my time any longer with YOUR """"attempts"""" at trying justify either your or Plasma Physics transgressions toward me or bother me any longer about this issue and I SHALL LEAVE YOU ALONE and seek others here who deserve my considerate attention. It appears that you two obviously should get along well together!.""",0,0,0,0,0,0
44dde209f85fd48a,"I'm retired, fuckers. Leave me alone.",0,0,0,0,1,0
fe03a87bf57cef8a,"Only Durzis call themselves as unitarians (Muwahhideen) in order to define/strengthen this Tawhid belief, the other even sects does not need this term.",0,0,0,0,0,0
2f21c422cced0cd7,"I'll fucking eat your queef asshole 

If you talk on my talk page, I'll rape your family you niggerlover.",0,0,0,1,0,0
d7aaabfd8799b464,"I hit a jack off all day, after the rape my mother, destroy the vagina until it hurts, then when you start bleeding I start to have sex with the mother of you Americans motherfuckers

They give the anus and the vagina every day for free, I'll sing a piece of music of Brazil who have money who slips into the vagina is not you jack off 10 year old girl already has at the vagina

The Brazilian soccer team is the best in the world humbles Americans

I get a boner from hell just eat your mother, that once again put out my articles you sons of bitches

vagina of mother north americans",0,0,0,1,0,0
4787fe36176bbc0e,"""::::::, what is the section you refer to as """"the reproductive toxicity section""""? There is no section named that. And secondly, who gives a """"rat's ass"""" about effects of a chemical on reproductive health? A lot of people do. What section are you speaking of, what particular content, and why would is it not useful to a reader?   
""",1,0,0,0,0,0
2579831571ff1b86,I think this IP address has been blocked. I'm unable to make any (constructive) edits to any articles. Grr! I hate when trolls use transparent proxies and get the rest of us (legitimate) users blocked.,0,0,0,0,0,0
160e59eb5c774995,"more training, less Wiki please 

and take care of your knee, please.",0,0,0,0,0,0
414d38c886ac5c52,"Notable Players
Should Zack Mills really be listed with the notable players?  He didn't even play a game.  WeatherManNX01 

Rewrite
I have added a lot of information to expand the article.  However, by no means is this perfect (of course).  I don't have the best writing style for an encyclopedia, so feel free to make edits.  I have all of my research, so if there's something that needs added or or cited, or anything like that, just let me know.  This article can be a decent one with a little work and effort. WeatherManNX01",0,0,0,0,0,0
08fbad18eeeeeb18,"SCREW YOU!!! 

YOU KNOW SOMETHING, YOU HAD ME BLOCKED BEFORE FOR SOMETHING THAT YOU VANDALIZED, AND SO DID THAT SPITHOLE User:Snowfire51. YOU ARE A SPITHOLE, AND THAT IS WHAT YOU WILL ALWAYS AMOUNT TO BE, FOREVER! GO AHEAD, BLOCK ME. BLOCK ME FOREVER AND EVER, BUT REMEMBER, YOU ARE A VANDALIZER JUST LIKE YOU'RE GANG OF FRIENDS, AND YOU WILL NEVER WIN, YOU WILL NEVER WIN!!!!! SO GO SHOVE OFF! YOU WILL NEVER GET AWAY WITH VANDALIZING PEOPLE'S PAGES, YOU WILL NEVER GET AWAY WITH IT!!!!!!!!!!!!",0,0,0,0,1,0
fd01eda1f4eb0088,"Acorn issues 

I was quite disappointed to have the changes I worked on earlier tonight stripped out and the page locked.  I wanted to include the current distress of ACORN and felt I was being careful in connecting relevant news agencies that would validate the issues.  Maybe my wording was less than ideal, but the content I wanted to convey certainly should be attributed to the current and apparently ongoing actions of ACORN.  Please reconsider and possible include the context of the issue more completely.  Thanks",0,0,0,0,0,0
621ebd9fd1cf53e6,"""

 Vandal IP 

Apologies. I'm a bit of a newbie here on some fundamentals of Wikipedia; how do I report? And no offense or anything, but you should try to archive soon. Thanks for your help! Triple M """,0,0,0,0,0,0
54b6c8c30baa680c,What the hell? What the fuck did I do now? It was a couple of harmless edits.,0,0,1,0,0,0
52f3c0a34173f1ea,I would like to point out that RJII is the only active editor on that article pushing for it to remain in its current form. Three others ( POV warrior who takes advantage of the difficulty in deleting anything on wikipedia to push his own agenda.,0,0,0,0,0,0
0593a8a738fedf41,"Igho Otegheri Deletion
Who the hell are you to decide what to delete and what not????!!!
you could go fuck yourself u little piece of shit..",0,0,1,0,0,0
007094f2f9efe035,"Correct, Dead is dead. There are, however, leves of wounds, hence the emphasis when they are serious. This is not a POV adjective.",0,0,0,0,0,0
f6f8086297273d04,"Revelation of a question. 

Was your mother a nigger?
That would explain alot.
SSing",0,0,0,0,0,1
0a49087b1e1f3c78,"Not anonymous lady, just hounded and blocked by this dick. I just gave you facts though you may not like them.  59.91.253.122",0,0,1,0,0,0
bb0dce2c87c2ced9,"I would appreciate if you could use more courtoisie when editing. The edit summaries  here and here denigrate me as a fellow editor. We may disagree as much as we wish content-wise, but please keep it civilized. I would also appreciate if you could please not revert anymore. Something bothers you: use the talk page to clarify the misunderstanding, please. \talk",0,0,0,0,0,0
